{
    "$schema": "https://json-schema.org/draft/2020-12/schema",
    "$id": "unsure what to put here",
    "title": "All Culture Instances",
    "description": "Lists the details for all culture instances.",
    "type": "array",
    "items": {
        "description": "Records the details for a culture instance.",
        "type": "object",
        "properties": {
            "id": {
                "description": "A unique identifier for a culture",
                "type": "number",
                "minimum": 0
            },
            "name": {
                "description": "The name for the country",
                "type": "string",
                "minLength": 1
            },
            "alpha2code": {
                "description": "The alpha2code for the country the culture represents",
                "type": "string",
                "minLength": 2,
                "maxLength": 2
            },
            "alpha3code": {
                "description": "The alpha3code for the country the culture represents",
                "type": "string",
                "minLength": 3,
                "maxLength": 3
            },
            "capital": {
                "description": "The capital city for the country",
                "type": "string",
                "minLength": 1
            },
            "flags": {
                "description": "Various image formats for the country flag",
                "type": "object",
                "properties": {
                    "svg": {
                        "description": "SVG image URL for the country flag",
                        "type": "string"
                    },
                    "png": {
                        "description": "PNG image URL for the country flag",
                        "type": "string"
                    }
                }
            },
            "currencies": {
                "type": "array",
                "items": {
                    "description": "Set of currencies used in the country",
                    "type": "object",
                    "properties": {
                        "code": {
                            "description": "Shorthand currency code",
                            "type": "string",
                            "minLength": 1
                        },
                        "name": {
                            "description": "Name of the currency",
                            "type": "string",
                            "minLength": 1
                        },
                        "symbol": {
                            "description": "Symbol text ASCII of the currency",
                            "type": "string",
                            "minLength": 1,
                            "maxLength": 1
                        }
                    },
                    "required": [
                        "code",
                        "name"
                    ],
                    "additionalProperties": false
                }
            },
            "languages": {
                "type": "array",
                "items": {
                    "description": "Languages spoken in the country",
                    "type": "string"
                },
                "minItems": 1,
                "uniqueItems": true
            },
            "subregion": {
                "description": "Subregion of the country",
                "type": "string"
            },
            "region": {
                "description": "Region of the country",
                "type": "string",
                "minLength": 1
            },
            "population": {
                "description": "Population of the country",
                "type": "number",
                "minimum": 0
            },
            "latlng": {
                "type": "array",
                "items": {
                    "description": "Latitude and Longitude of the country",
                    "type": "number",
                    "minimum": -180,
                    "maximum": 180
                },
                "minItems": 2,
                "maxItems": 2
            },
            "demonym": {
                "description": "Demonym of the country",
                "type": "string",
                "minLength": 1
            },
            "regional_blocs": {
                "type": "array",
                "items": {
                    "description": "The regional blocs the country is involved in",
                    "type": "object",
                    "properties": {
                        "acronym": {
                            "description": "Commonly-known acronym for the regional bloc's name",
                            "type": "string"
                        },
                        "name" : {
                            "description": "Name of the regional bloc",
                            "type": "string",
                            "minLength": 1
                        }
                    },
                    "required": [
                        "name"
                    ],
                    "additionalProperties": false
                },
                "uniqueItems": true
            },
            "independent": {
                "type": "boolean",
                "description": "Whether the country is independent or dependent"
            },
            "summary": {
                "description": "Quick short summary describing the country",
                "type": "string",
                "minLength": 1
            }
        },
        "required": [
            "id",
            "name",
            "alpha2code",
            "alpha3code",
            "capital",
            "flags",
            "currencies",
            "languages",
            "subregion",
            "region",
            "population",
            "latlng",
            "demonym",
            "independent",
            "summary"
        ],
        "additionalProperties": false
    }
}